link_name,status_link
"10/1 Happenings: HBD Specs, Jim & Vance; Max Swipes 51; O'Connell Deal; Danny Quits & More...",http://beforeitsnews.com/sports/2017/10/101-happenings-hbd-specs-jim-vance-max-swipes-51-oconnell-deal-danny-quits-more-2701630.html
The NRA Is Responsible For Mass Shooting Epidemic In America,http://beforeitsnews.com/u-s-politics/2017/10/the-nra-is-responsible-for-mass-shooting-epidemic-in-america-2537302.html
Trump On Gun Violence: ‘We’re Not Going To Talk About That’,http://beforeitsnews.com/u-s-politics/2017/10/trump-on-gun-violence-were-not-going-to-talk-about-that-2537298.html
LA Releases First Single SHOWTIME,http://beforeitsnews.com/entertainment/2017/10/la-releases-first-single-showtime-2670642.html
Swiss Dept. of Public Instruction Implements “Precautionary Principle” Regarding Wi-Fi And Other Smart Tech Devices,https://www.activistpost.com/2017/09/swiss-dept-public-instruction-implements-precautionary-principle-regarding-wi-fi-smart-tech-devices.html
Trickle Down Taxation - A.F. Branco,http://beforeitsnews.com/u-s-politics/2017/09/trickle-down-taxation-a-f-branco-2536927.html
Ravens vs. Steelers - Friday/Game Status,http://beforeitsnews.com/sports/2017/09/ravens-vs-steelers-fridaygame-status-3-2701521.html
Oklahoma Lesbian Couple Sentenced to 20 Years for Beating and Torturing Child,http://beforeitsnews.com/u-s-politics/2017/10/oklahoma-lesbian-couple-sentenced-to-20-years-for-beating-and-torturing-child-2537169.html
ACC Network headed to Bristol and other ACC Network Notes.,http://beforeitsnews.com/sports/2017/09/acc-network-headed-to-bristol-and-other-acc-network-notes-2-2701349.html
Vatican Kidnaps Teenage Girl Leaked Letter Says,http://beforeitsnews.com/scandals/2017/09/vatican-kidnaps-teenage-girl-leaked-letter-says-2437327.html
Pittsburgh Steelers Are Genuine Contenders For Super Bowl LII,http://beforeitsnews.com/sports/2017/09/pittsburgh-steelers-are-genuine-contenders-for-super-bowl-lii-2701494.html
"They Put Crackers On A Baking Sheet – When It Came Out Of The Oven, I Was Drooling!",http://dailybuzzlive.com/they-put-crackers-on-a-baking-sheet-when-it-came-out-of-the-oven-i-was-drooling/
Dolphins Reinstate Linebacker Lawrence Timmons,http://beforeitsnews.com/sports/2017/09/dolphins-reinstate-linebacker-lawrence-timmons-2701223.html
Dolphins Coach Adam Gase Has No Issues With Jay Cutler in the Wildcat,http://beforeitsnews.com/sports/2017/10/dolphins-coach-adam-gase-has-no-issues-with-jay-cutler-in-the-wildcat-2701977.html
"NFL Teams Stayed in Locker Rooms For Anthem Until 2009-Then DoD Began ""Paying for Patriotism""",https://www.activistpost.com/2017/09/nfl-teams-stayed-locker-rooms-anthem-2009-dod-began-paying-patriotism.html
UN Allegedly Nixed A Report That Predicted The Rohingya Crisis,http://beforeitsnews.com/u-s-politics/2017/10/un-allegedly-nixed-a-report-that-predicted-the-rohingya-crisis-2537360.html
"Suburban Symphony Release Debut Single ""Stepping Stones"" On Hilltown Records",http://beforeitsnews.com/entertainment/2017/09/suburban-symphony-release-debut-single-stepping-stones-on-hilltown-records-2670531.html
Hawaii Becomes First U.S. State To Go Cashless For Marijuana Sales,https://www.activistpost.com/2017/09/hawaii-becomes-first-u-s-state-to-go-cashless-for-marijuana-sales.html
"This Is An American Warning, We Are Headed For Rough Times David Robertson",http://beforeitsnews.com/u-s-politics/2017/10/this-is-an-american-warning-we-are-headed-for-rough-times-david-robertson-2537082.html
Sports,http://beforeitsnews.com/sports/2017/09/63-2701548.html
This 500-Million-Year-Old Organism Really Looks Like A Space Alien,http://www.disclose.tv/news/this_500millionyearold_organism_really_looks_like_a_space_alien/140338
ISIS Claims Las Vegas Shooter ‘A Soldier’ Who Converted to Islam ‘Months Ago’,http://beforeitsnews.com/u-s-politics/2017/10/isis-claims-las-vegas-shooter-a-soldier-who-converted-to-islam-months-ago-2537158.html
Julia Louis-Dreyfus Backs Universal Health Care In Breast Cancer Post,http://beforeitsnews.com/u-s-politics/2017/09/julia-louis-dreyfus-backs-universal-health-care-in-breast-cancer-post-2536946.html
PRESIDENT TRUMP says: Las Vegas shooting - Live updates,http://beforeitsnews.com/u-s-politics/2017/10/president-trump-says-las-vegas-shooting-live-updates-2537187.html
"This Is An American Warning, We Are Headed For Rough Times David Robertson",http://beforeitsnews.com/u-s-politics/2017/10/this-is-an-american-warning-we-are-headed-for-rough-times-david-robertson-2537082.html
Classy NHL Champ Pittsburgh Penguins Will Visit with Trump at White House,http://beforeitsnews.com/u-s-politics/2017/09/classy-nhl-champ-pittsburgh-penguins-will-visit-with-trump-at-white-house-2536686.html
Declassified CIA document reveals the true shape of our universe,http://www.disclose.tv/news/declassified_cia_document_reveals_the_true_shape_of_our_universe/140432
2017 NFL Picks - Week 5,http://beforeitsnews.com/sports/2017/10/2017-nfl-picks-week-5-2701893.html
"Sunday: One & Done - Brault v Gio Gonzalez, Lineup, Notes",http://beforeitsnews.com/sports/2017/10/sunday-one-done-brault-v-gio-gonzalez-lineup-notes-2701636.html
NASCAR Owners: Don’t Even THINK About Protesting Anthem,http://beforeitsnews.com/u-s-politics/2017/09/nascar-owners-dont-even-think-about-protesting-anthem-2536716.html
NFL Sunday Night Ratings Tank Again After Week Two of Anti-Trump Protests,http://beforeitsnews.com/u-s-politics/2017/10/nfl-sunday-night-ratings-tank-again-after-week-two-of-anti-trump-protests-2537214.html
A New Black Belt in Temple Karate,http://beforeitsnews.com/sports/2017/10/a-new-black-belt-in-temple-karate-2701860.html
Washington Post Fails To Cover Amazon’s Nearly $300 Million Dollar Fine For Tax Dodging,https://www.activistpost.com/2017/10/washington-post-fails-to-cover-amazon-nearly-300-million-dollar-fine-for-tax-dodging.html
Black Students Kicked Out Of Team For #TakeAKnee,http://beforeitsnews.com/u-s-politics/2017/10/black-students-kicked-out-of-team-for-takeaknee-2537075.html
Sticker Proclaiming ‘KKK Wants You’ Found At A Portland High School,http://beforeitsnews.com/u-s-politics/2017/09/sticker-proclaiming-kkk-wants-you-found-at-a-portland-high-school-2536919.html
"9/30 TRS-PNC Era: 3,000 For Roberto, '79 Clincher, HBD Bryan, Cover Boy Scoops, Game Stories",http://beforeitsnews.com/sports/2017/09/930-trs-pnc-era-3000-for-roberto-79-clincher-hbd-bryan-cover-boy-scoops-game-stories-2701559.html
The Walking Dead Season 8: Season Premiere [sneak peak],http://beforeitsnews.com/u-s-politics/2017/10/the-walking-dead-season-8-season-premiere-sneak-peak-2537564.html
"Friday: Pirates at Nats, Cole v Strasburg, Lineup, Notes",http://beforeitsnews.com/sports/2017/09/friday-pirates-at-nats-cole-v-strasburg-lineup-notes-2701529.html
Inside Broadmoor,http://beforeitsnews.com/entertainment/2017/10/inside-broadmoor-2670629.html
23 COOL HACKS THAT’LL COST YOU LESS THAN A DOLLAR,http://dailybuzzlive.com/cool-hacks-thatll-cost-less-dollar/
"U.S. President Donald Trump Quietly Signs Law To Allow Warrantless Searches In Parts Of VA, DC and MD",https://www.activistpost.com/2017/09/u-s-president-donald-trump-quietly-signs-law-allow-warrant-less-searches-parts-va-dc-md.html
FEMA Expected to Run Out of Money by Friday as Superstorm Irma Approaches Florida,https://www.activistpost.com/2017/09/fema-expected-run-money-friday-superstorm-irma-approaches-florida.html
Trump Admin Chooses Israeli Arms Maker To Build Border Wall Prototype,http://beforeitsnews.com/u-s-politics/2017/09/trump-admin-chooses-israeli-arms-maker-to-build-border-wall-prototype-2536821.html
Week 4 Rankings (2017): Top 15 Defenses,http://beforeitsnews.com/sports/2017/09/week-4-rankings-2017-top-15-defenses-2701416.html
Your Ancestors Didn’t Sleep Like You,http://www.disclose.tv/news/your_ancestors_didnt_sleep_like_you/140370
Video captures fistfight between passengers on flight to Los Angeles,http://dailybuzzlive.com/video-captures-fistfight-passengers-flight-los-angeles/
"Fecal bacteria found in drinks at McDonald’s, Burger King and KFC",http://dailybuzzlive.com/fecal-bacteria-found-drinks-mcdonalds-burger-king-kfc/
"Trump's Border Wall Approved By House Panel, Includes Drones, DNA Collection, Biometric Scans",https://www.activistpost.com/2017/10/trumps-border-wall-approved-by-house-panel-includes-drones-dna-collection-biometric-scans.html
NLDS: Kyle Hendricks to start Game 1 vs. Nationals,http://beforeitsnews.com/sports/2017/10/nlds-kyle-hendricks-to-start-game-1-vs-nationals-2701941.html
Blue Martinez,http://beforeitsnews.com/entertainment/2017/09/blue-martinez-2670571.html
Week 4 Rankings (2017): Top 25 Quarterbacks: Top 10 Surprises & More,http://beforeitsnews.com/sports/2017/09/week-4-rankings-2017-top-25-quarterbacks-top-10-surprises-more-2701168.html
2017 Fantasy Football IDP Rankings - Week 5,http://beforeitsnews.com/sports/2017/10/2017-fantasy-football-idp-rankings-week-5-2702010.html
Can Ravens Bounce Back vs. Rivals?,http://beforeitsnews.com/sports/2017/09/can-ravens-bounce-back-vs-rivals-2701273.html
BlackWolfOscar Shows His Growth As An Artist On His Latest Single 'Marigold',http://beforeitsnews.com/entertainment/2017/10/blackwolfoscar-shows-his-growth-as-an-artist-on-his-latest-single-marigold-2670655.html
"President, First Lady Visit Heroes of Las Vegas Shooting [Live Stream]",http://beforeitsnews.com/u-s-politics/2017/10/president-first-lady-visit-heroes-of-las-vegas-shooting-live-stream-2537258.html
The Suicide Plan,http://beforeitsnews.com/entertainment/2017/09/the-suicide-plan-2670535.html
Dolphins Reinstate Linebacker Lawrence Timmons,http://beforeitsnews.com/sports/2017/09/dolphins-reinstate-linebacker-lawrence-timmons-2701223.html
Ravens Won’t Back Down,http://beforeitsnews.com/sports/2017/10/ravens-wont-back-down-2701798.html
Was There More Than One Shooter In Vegas?,http://beforeitsnews.com/u-s-politics/2017/10/was-there-more-than-one-shooter-in-vegas-2537283.html
"10/3 Happenings: HBD Cap, Johnny, Dog, Tomato, Ismael, Wil & Alex; Frankie & Gene Hired; Clarke Retires",http://beforeitsnews.com/sports/2017/10/103-happenings-hbd-cap-johnny-dog-tomato-ismael-wil-alex-frankie-gene-hired-clarke-retires-2701818.html
2017 Fantasy Football IDP Rankings - Week 4,http://beforeitsnews.com/sports/2017/09/2017-fantasy-football-idp-rankings-week-4-2701374.html
Eric Church - “Why Not Me” [Video and Lyrics],http://beforeitsnews.com/u-s-politics/2017/10/eric-church-why-not-me-video-and-lyrics-2537464.html
"All-star Ensemble FLOW Debuts Genre-Defying New Music At Carnegie Hall On Friday October 6, 2017",http://beforeitsnews.com/entertainment/2017/09/all-star-ensemble-flow-debuts-genre-defying-new-music-at-carnegie-hall-on-friday-october-6-2017-2670607.html
"Ray Says He Was Praying, Not Protesting",http://beforeitsnews.com/sports/2017/09/ray-says-he-was-praying-not-protesting-2701397.html
"Three Never-Before-Seen Asteroids Just Missed Earth By Only 120,000 Miles",http://www.disclose.tv/news/three_neverbeforeseen_asteroids_just_missed_earth_by_only_120000_miles/140346
"Ryan Gosling, Guy On A Boat Give Dating Advice On SNL",http://beforeitsnews.com/u-s-politics/2017/10/ryan-gosling-guy-on-a-boat-give-dating-advice-on-snl-2537090.html
Finally A Camping Trip ANYONE Can Handle – Check Out These Luxury Campers!,http://dailybuzzlive.com/finally-a-camping-trip-anyone-can-handle-check-out-these-luxury-campers/
64 YO Stephen Paddock Identified As The Gunman Behind LV Mass Shooting,http://beforeitsnews.com/u-s-politics/2017/10/64-yo-stephen-paddock-identified-as-the-gunman-behind-lv-mass-shooting-2537139.html
"10/5 Expo Park-Forbes Field: Bucs Win '60 Opener, Lose '27; Pud's 300; HBD Claude, Felix & Sarge; Grays Win WS",http://beforeitsnews.com/sports/2017/10/105-expo-park-forbes-field-bucs-win-60-opener-lose-27-puds-300-hbd-claude-felix-sarge-grays-win-ws-2701996.html
Can Ravens End Losing Skid?,http://beforeitsnews.com/sports/2017/10/can-ravens-end-losing-skid-2702110.html
Can Ravens Win 7th of 9 vs. Steelers?,http://beforeitsnews.com/sports/2017/09/can-ravens-win-7th-of-9-vs-steelers-2701568.html
2017 Fantasy Football Team Defense Rankings - Week 5,http://beforeitsnews.com/sports/2017/10/2017-fantasy-football-team-defense-rankings-week-5-2701900.html
"Bipartisan Congress Put Jeff Sessions in His Place, Shut Down His Expansion of Civil Asset Forfeiture",https://www.activistpost.com/2017/09/bipartisan-congress-put-jeff-sessions-place-shut-expansion-civil-asset-forfeiture.html
The Spy in the IRA,http://beforeitsnews.com/entertainment/2017/10/the-spy-in-the-ira-2670627.html
Does Amazon Sell Fake Products For Shooters?,http://beforeitsnews.com/u-s-politics/2017/09/does-amazon-sell-fake-products-for-shooters-2536971.html
"U.S. Senate Betrays Constitution, Fails To Stop Perpetual War Policy",https://www.activistpost.com/2017/09/us-senate-betrays-constitution-fails-to-stop-perpetual-war-policy.html
Chinese Police Orders Uyghur Muslims To Hand In The Holy Quran,http://beforeitsnews.com/u-s-politics/2017/10/chinese-police-orders-uyghur-muslims-to-hand-in-the-holy-quran-2537074.html
JetNation FanDuel League; Week 4,http://beforeitsnews.com/sports/2017/09/jetnation-fanduel-league-week-4-2701323.html
Columbus day 2017: Trump's praise of Columbus omits dark history,http://beforeitsnews.com/u-s-politics/2017/10/columbus-day-2017-trumps-praise-of-columbus-omits-dark-history-2537630.html
"10/2 Happenings: HBD Ernie,Honest Eddie, Rex, Maury, Big Red & Marino; Lamont Axed, Bucs Sold & More",http://beforeitsnews.com/sports/2017/10/102-happenings-hbd-erniehonest-eddie-rex-maury-big-red-marino-lamont-axed-bucs-sold-more-2701710.html
Hey Mr. Girardi... Respect,http://beforeitsnews.com/sports/2017/10/hey-mr-girardi-respect-2701911.html
Super-Engineered 'N6' Antibody Kills 99% Of HIV Strains - Human Trials Start In 2018,http://www.disclose.tv/news/superengineered_n6_antibody_kills_99_of_hiv_strains__human_trials_start_in_2018/140365
Mitchell Trubisky’s debut comes at the right time of the schedule,http://beforeitsnews.com/sports/2017/10/mitchell-trubiskys-debut-comes-at-the-right-time-of-the-schedule-2702044.html
NRA Calls for ATF to Review Bump Fire Stocks - Why it won’t matter,http://beforeitsnews.com/u-s-politics/2017/10/nra-calls-for-atf-to-review-bump-fire-stocks-why-it-wont-matter-2537381.html
New York Jets Report Card: Week 5,http://beforeitsnews.com/sports/2017/10/new-york-jets-report-card-week-5-5-2702290.html
CycleBar Westgate West Hosts Benefit Cycle Ride to Help ‘Fragile Bone Disease’ Foundation on Oct. 7,http://beforeitsnews.com/sports/2017/10/cyclebar-westgate-west-hosts-benefit-cycle-ride-to-help-fragile-bone-disease-foundation-on-oct-7-2701768.html
Time for Tomlin to Nip the National Anthem Chaos in the Bud for the Sake of the Steelers Future,http://beforeitsnews.com/sports/2017/09/time-for-tomlin-to-nip-the-national-anthem-chaos-in-the-bud-for-the-sake-of-the-steelers-future-2701209.html
Everybody out?,http://beforeitsnews.com/sports/2017/09/everybody-out-2701062.html
Terence McKenna’s True Hallucinations,http://beforeitsnews.com/entertainment/2017/09/terence-mckennas-true-hallucinations-2670561.html
Mother Heads To Jail For Disobeying Court Order To Vaccinate Son,http://beforeitsnews.com/u-s-politics/2017/10/mother-heads-to-jail-for-disobeying-court-order-to-vaccinate-son-2537476.html
"Former Police Officer Arrested With Massive Arsenal Near White House, Claims He Was A CIA MK Ultra Asset",https://www.activistpost.com/2017/10/former-police-officer-arrested-massive-arsenal-near-white-house-claims-cia-mk-ultra-asset.html
Self Inflicted,http://beforeitsnews.com/sports/2017/10/self-inflicted-2702265.html
"10/4 Expo Park-Forbes Field Era: '08 To the Wire; HBD Jim, Red, Joe & Billy; 103 Wins in '02; Running Into Trouble",http://beforeitsnews.com/sports/2017/10/104-expo-park-forbes-field-era-08-to-the-wire-hbd-jim-red-joe-billy-103-wins-in-02-running-into-trouble-2701892.html
"10 Important Stories From 09/30/17 Box Scores: McCullers’ Poor Showing, Taillon Looks Like An Ace & More",http://beforeitsnews.com/sports/2017/10/10-important-stories-from-093017-box-scores-mccullers-poor-showing-taillon-looks-like-an-ace-more-2701621.html
"9/28 Through the 40s: The Gloaming; HBD Bill, Lou, Cy the Third, Everett, Cy, Leon & Buck; Clarke Honored;Tiny 2-Hitter",http://beforeitsnews.com/sports/2017/09/928-through-the-40s-the-gloaming-hbd-bill-lou-cy-the-third-everett-cy-leon-buck-clarke-honoredtiny-2-hitter-2701370.html
Avid Hunter Don Jr. On Gun Silencers: ‘It's Just A Great Instrument’,http://beforeitsnews.com/u-s-politics/2017/10/avid-hunter-don-jr-on-gun-silencers-its-just-a-great-instrument-2537262.html
"10/4 TRS-PNC Park Era: Reds Thump Buc 3x in Playoffs; Cole Beats Cards; Bucs Clich in '15; Syd, JR Axed;",http://beforeitsnews.com/sports/2017/10/104-trs-pnc-park-era-reds-thump-buc-3x-in-playoffs-cole-beats-cards-bucs-clich-in-15-syd-jr-axed-2701907.html
Police Broke Up a Drug-Fueled Vatican Priest Orgy,http://dailybuzzlive.com/police-broke-drug-fueled-vatican-priest-orgy/
U Of Michigan Student Takes A Knee For Over 20 Hours To Protest Racism,http://beforeitsnews.com/u-s-politics/2017/09/u-of-michigan-student-takes-a-knee-for-over-20-hours-to-protest-racism-2536915.html
This Cop Tried And Failed To Sue #BlackLivesMatter,http://beforeitsnews.com/u-s-politics/2017/10/this-cop-tried-and-failed-to-sue-blacklivesmatter-2537228.html
Steve Scalise: Being Shot ‘Fortified' My Views On Gun Rights,http://beforeitsnews.com/u-s-politics/2017/10/steve-scalise-being-shot-fortified-my-views-on-gun-rights-2537257.html
Flipping Out - A.F. Branco Cartoon,http://beforeitsnews.com/u-s-politics/2017/09/flipping-out-a-f-branco-cartoon-2536801.html
Houston Prepares To Be Sprayed By Bee-Killing Chemicals to Fight Mosquitoes,https://www.activistpost.com/2017/09/houston-prepares-to-be-sprayed-by-bee-killing-chemicals-to-fight-mosquitoes.html
Ravens’ Problems Start at the Top,http://beforeitsnews.com/sports/2017/10/ravens-problems-start-at-the-top-2701720.html
"Carmen Cruz, Mayor of San Juan Is A “Godsend” For Puerto Ricans",http://beforeitsnews.com/u-s-politics/2017/10/carmen-cruz-mayor-of-san-juan-is-a-godsend-for-puerto-ricans-2537166.html
"How the Great Pyramid was built, if it wasn't ALIENS",http://www.disclose.tv/news/how_the_great_pyramid_was_built_if_it_wasnt_aliens/140426
SNL: Michael Che Calls Trump “You B*tch” Over Puerto Rico Response,http://beforeitsnews.com/u-s-politics/2017/10/snl-michael-che-calls-trump-you-btch-over-puerto-rico-response-2537087.html
Colin Kaepernick Never a Thought for the Titans After Mariota’s Injury,http://beforeitsnews.com/sports/2017/10/colin-kaepernick-never-a-thought-for-the-titans-after-mariotas-injury-2701970.html
Hybrid Studios Joins Earthquaker Devices Studio Program,http://beforeitsnews.com/entertainment/2017/09/hybrid-studios-joins-earthquaker-devices-studio-program-2670525.html
"Ray Says He Was Praying, Not Protesting",http://beforeitsnews.com/sports/2017/09/ray-says-he-was-praying-not-protesting-2701397.html
President Donald Trump Delivers Weekly Address 10/6/17 [Video and Transcript],http://beforeitsnews.com/u-s-politics/2017/10/president-donald-trump-delivers-weekly-address-10617-video-and-transcript-2537454.html
Crossfit Training: The Upperclassman,http://beforeitsnews.com/sports/2017/10/crossfit-training-the-upperclassman-2701858.html
"Singer-Songwriter and Pianist, Shauna Burns, Announces New Release: “Scarborough Fair,” Coming 10/6/17!",http://beforeitsnews.com/entertainment/2017/09/singer-songwriter-and-pianist-shauna-burns-announces-new-release-scarborough-fair-coming-10617-2670599.html
"10/3 Expo Park-Forbes Field Era: Pirates, Grays WS Win, Game Stories",http://beforeitsnews.com/sports/2017/10/103-expo-park-forbes-field-era-pirates-grays-ws-win-game-stories-2701784.html
UK Supermarket Becomes World’s First to Offer Cashless Checkout with Finger Vein Scan,https://www.activistpost.com/2017/09/uk-supermarket-worlds-first-cashless-finger-vein-scan.html
Police Officers In Chicago Reprimanded For Taking A Knee,http://beforeitsnews.com/u-s-politics/2017/09/police-officers-in-chicago-reprimanded-for-taking-a-knee-2536736.html
"How the Liberty Media Can Overcome Censorship, Demonetization and Deplatforming",https://www.activistpost.com/2017/10/liberty-media-can-overcome-censorship-demonetization-deplatforming.html
"President Donald Trump’s Schedule for Friday, October 6, 2017",http://beforeitsnews.com/u-s-politics/2017/10/president-donald-trumps-schedule-for-friday-october-6-2017-2537392.html
Meghan McCain Slams Trump For ‘Physically Mocking’ Her Father,http://beforeitsnews.com/u-s-politics/2017/09/meghan-mccain-slams-trump-for-physically-mocking-her-father-2536891.html
Meet The Racist GOP Candidate On A ‘Special Assignment’ From Trump,http://beforeitsnews.com/u-s-politics/2017/10/meet-the-racist-gop-candidate-on-a-special-assignment-from-trump-2537252.html
Migration of the Tax Donkeys,https://www.activistpost.com/2017/10/migration-tax-donkeys.html
The Rock Has Officially Filed His 2020 Presidential Campaign,http://dailybuzzlive.com/rock-officially-filed-2020-presidential-campaign/
A Timeless Voice And A Violin - A Duet Like No Other,http://beforeitsnews.com/entertainment/2017/10/a-timeless-voice-and-a-violin-a-duet-like-no-other-2670648.html
Week 5 Rankings (2017): Top 15 Kickers,http://beforeitsnews.com/sports/2017/10/week-5-rankings-2017-top-15-kickers-2702038.html
"President Donald Trump’s Schedule for Saturday, October 7, 2017",http://beforeitsnews.com/u-s-politics/2017/10/president-donald-trumps-schedule-for-saturday-october-7-2017-2537477.html
Amazing F-16 Night Takeoff,http://beforeitsnews.com/u-s-politics/2017/10/amazing-f-16-night-take-off-2537186.html
"Yea, We Are In The Playoffs But...",http://beforeitsnews.com/sports/2017/10/yea-we-are-in-the-playoffs-but-2701632.html
Former Steelers Safety Ryan Clark Says Antonio Brown Not the Team Player He’s Made Out to Be,http://beforeitsnews.com/sports/2017/10/former-steelers-safety-ryan-clark-says-antonio-brown-not-the-team-player-hes-made-out-to-be-2701938.html
Young Guns Step up in Jets 20-6 Victory Over Dolphins,http://beforeitsnews.com/sports/2017/09/young-guns-step-up-in-jets-20-6-victory-over-dolphins-2701056.html
Relaxing into the Original Style of Karate,http://beforeitsnews.com/sports/2017/09/relaxing-into-the-original-style-of-karate-2701327.html
2017 NLDS schedule: Chicago Cubs vs. Washington Nationals,http://beforeitsnews.com/sports/2017/09/2017-nlds-schedule-chicago-cubs-vs-washington-nationals-2701357.html
In The Shadow Of Feeling,http://beforeitsnews.com/entertainment/2017/09/in-the-shadow-of-feeling-2670602.html
"Caspar McCloud Releases First Acoustic Worship Album ""Pictures Of Jesus""",http://beforeitsnews.com/entertainment/2017/10/caspar-mccloud-releases-first-acoustic-worship-album-pictures-of-jesus-2670631.html
Maine Law Prohibits Any State Gun Registry,https://www.activistpost.com/2017/09/new-maine-law-prohibits-state-gun-registry.html
Are there really ‘Secrets to Success’?,http://beforeitsnews.com/u-s-politics/2017/09/are-there-really-secrets-to-success-2536904.html
San Juan Mayor Sports ‘Help Us We Are Dying’ T-Shirt for Anti-Trump CNN Interview,http://beforeitsnews.com/u-s-politics/2017/09/san-juan-mayor-sports-help-us-we-are-dying-t-shirt-for-anti-trump-cnn-interview-2537044.html
"Apollo 17 and the mystery of the last moon landing, why haven’t we returned",http://beforeitsnews.com/u-s-politics/2017/10/apollo-17-and-the-mystery-of-the-last-moon-landing-why-havent-we-returned-2537634.html
Two New Montana Laws Take on Warrantless Electronic Data Collection,https://www.activistpost.com/2017/10/two-new-montana-laws-take-warrantless-electronic-data-collection.html
Jared Kushner Has Been Reportedly Voting As A Woman For 8 Years,http://beforeitsnews.com/u-s-politics/2017/09/jared-kushner-has-been-reportedly-voting-as-a-woman-for-8-years-2536913.html
ChiCitySports Fantasy Review: Week 5 Fantasy Football Rankings,http://beforeitsnews.com/sports/2017/10/chicitysports-fantasy-review-week-5-fantasy-football-rankings-2701952.html
Son of a B! Absolute Proof More Than One Shooter! Listen to This Video! Undeniable! (Video); UNREAL & Unseen footage Vegas Mandalay bay…. wait for it; PROOF: MEDIA & LAW ENFORCEMENT ARE LYING ABOUT THE VEGAS SHOOTING; Hillary slammed for ignorant gun remarks after Vegas tragedy,http://beforeitsnews.com/alternative/2017/10/son-of-a-b-absolute-proof-more-than-one-shooter-listen-to-this-video-undeniable-video-3559083.html
ChiCitySports Fantasy Review: Week 4 DFS Picks,http://beforeitsnews.com/sports/2017/09/chicitysports-fantasy-review-week-4-dfs-picks-2701534.html
Celebrities Tweeting Geeky Photos To Help Raise Funds For Puerto Rico,http://beforeitsnews.com/u-s-politics/2017/10/celebrities-tweeting-geeky-photos-to-help-raise-funds-for-puerto-rico-2537094.html
King Salman’s Favorite Golden Escalator Betrays Him On Visit To Moscow,http://beforeitsnews.com/u-s-politics/2017/10/king-salmans-favorite-golden-escalator-betrays-him-on-visit-to-moscow-2537412.html
WikiLeaks Releases Moscow's Surveillance Files,https://www.activistpost.com/2017/10/wikileaks-releases-moscows-surveillance-files.html
A Man Approached Some Homeless People And Asked Them What They Wanted For Christmas,http://dailybuzzlive.com/a-man-approached-some-homeless-people-and-asked-them-what-they-wanted-for-christmas/
Chicago Blackhawks defeat the salary cap menace,http://beforeitsnews.com/sports/2017/10/chicago-blackhawks-defeat-the-salary-cap-menace-2701865.html
Brandon Saad records hat trick in first game back with Chicago Blackhawks,http://beforeitsnews.com/sports/2017/10/brandon-saad-records-hat-trick-in-first-game-back-with-chicago-blackhawks-2702059.html
Sports,http://beforeitsnews.com/sports/2017/09/63-2701548.html
