link_name,status_link
JetNation FanDuel League; Week 4,http://beforeitsnews.com/sports/2017/09/jetnation-fanduel-league-week-4-2701323.html
"U.S. President Donald Trump Quietly Signs Law To Allow Warrantless Searches In Parts Of VA, DC and MD",https://www.activistpost.com/2017/09/u-s-president-donald-trump-quietly-signs-law-allow-warrant-less-searches-parts-va-dc-md.html
2017 Fantasy Football Team Defense Rankings - Week 5,http://beforeitsnews.com/sports/2017/10/2017-fantasy-football-team-defense-rankings-week-5-2701900.html
Just Shut Up & Play Some Damn Baseball!!,http://beforeitsnews.com/sports/2017/09/just-shut-up-play-some-damn-baseball-2701059.html
"10/7: Chuck Axed; HBD Brickyard, Adam, Moonlight Ace & Chuck; AS; Season Finales...",http://beforeitsnews.com/sports/2017/10/107-chuck-axed-hbd-brickyard-adam-moonlight-ace-chuck-as-season-finales-2702154.html
Trump Bemoans ‘Little Appreciation’ As San Juan Mayor Begs For Water,http://beforeitsnews.com/u-s-politics/2017/10/trump-bemoans-little-appreciation-as-san-juan-mayor-begs-for-water-2537595.html
"In Meeting With Military, Trump Talks Of 'Calm Before The Storm'",http://beforeitsnews.com/u-s-politics/2017/10/in-meeting-with-military-trump-talks-of-calm-before-the-storm-2537421.html
Teacher Sparks Outrage By Asking Kids To Make Nazi Mascots,http://beforeitsnews.com/u-s-politics/2017/10/teacher-sparks-outrage-by-asking-kids-to-make-nazi-mascots-2537450.html
"9/28 Through the 40s: The Gloaming; HBD Bill, Lou, Cy the Third, Everett, Cy, Leon & Buck; Clarke Honored;Tiny 2-Hitter",http://beforeitsnews.com/sports/2017/09/928-through-the-40s-the-gloaming-hbd-bill-lou-cy-the-third-everett-cy-leon-buck-clarke-honoredtiny-2-hitter-2701370.html
Hillary Clinton Suggests That Trump May Order the Murder of Journalists,http://beforeitsnews.com/u-s-politics/2017/09/hillary-clinton-suggests-that-trump-may-order-the-murder-of-journalists-2536870.html
"9/29 Through the 40s: HBD Cannonball & Paul, Camnitz Clan, Game Stories",http://beforeitsnews.com/sports/2017/09/929-through-the-40s-hbd-cannonball-paul-camnitz-clan-game-stories-2701470.html
"10/3 Expo Park-Forbes Field Era: Pirates, Grays WS Win, Game Stories",http://beforeitsnews.com/sports/2017/10/103-expo-park-forbes-field-era-pirates-grays-ws-win-game-stories-2701784.html
Blackhawks Roster Breakdown: Goalies,http://beforeitsnews.com/sports/2017/09/blackhawks-roster-breakdown-goalies-2701437.html
CycleBar Westgate West Hosts Benefit Cycle Ride to Help ‘Fragile Bone Disease’ Foundation on Oct. 7,http://beforeitsnews.com/sports/2017/10/cyclebar-westgate-west-hosts-benefit-cycle-ride-to-help-fragile-bone-disease-foundation-on-oct-7-2701768.html
PA Attorney General Concerned About Equifax Cyberattack; Will U.S. Attorneys General Be Upset About Utility Smart Meters Hacking?,https://www.activistpost.com/2017/10/pa-attorney-general-concerned-equifax-cyberattack-will-us-attorneys-general-upset-utility-smart-meters-hacking.html
"10/1 Expo Park-Forbes Field Era: Deacon Whips Cy In 1st WS Game, Waner's 237 Hits, Boss Man Roberto & More",http://beforeitsnews.com/sports/2017/10/101-expo-park-forbes-field-era-deacon-whips-cy-in-1st-ws-game-waners-237-hits-boss-man-roberto-more-2701623.html
Google Clips Automatically Identifies Everyone Including Your Pets,https://www.activistpost.com/2017/10/google-clips-automatically-identifies-everyone-including-pets.html
2017 Fantasy Football Kicker Rankings - Week 4,http://beforeitsnews.com/sports/2017/09/2017-fantasy-football-kicker-rankings-week-4-2701252.html
"A ""problem"" For The Wild Card Game & Sanchez...",http://beforeitsnews.com/sports/2017/10/a-problem-for-the-wild-card-game-sanchez-2701709.html
2017 Fantasy Football Running Back Rankings - Week 5,http://beforeitsnews.com/sports/2017/10/2017-fantasy-football-running-back-rankings-week-5-2701799.html
What Would Happen To You in The Microwave?,http://beforeitsnews.com/u-s-politics/2017/09/what-would-happen-to-you-in-the-microwave-2536907.html
Ravens vs. Steelers - Friday/Game Status,http://beforeitsnews.com/sports/2017/09/ravens-vs-steelers-fridaygame-status-3-2701521.html
Newton Laughs at Female Reporter After Asking a Question About WR Routes,http://beforeitsnews.com/sports/2017/10/newton-laughs-at-female-reporter-after-asking-a-question-about-wr-routes-2701973.html
Las Vegas Police Deny NFL’s Michael Bennett Was Racially Profiled as Video Rebuts Player’s Claims,http://beforeitsnews.com/u-s-politics/2017/09/las-vegas-police-deny-nfls-michael-bennett-was-racially-profiled-as-video-rebuts-players-claims-2537055.html
"10/7: Chuck Axed; HBD Brickyard, Adam, Moonlight Ace & Chuck; AS; Season Finales...",http://beforeitsnews.com/sports/2017/10/107-chuck-axed-hbd-brickyard-adam-moonlight-ace-chuck-as-season-finales-2702154.html
Pumpkin Spiced White Hot Chocolate,http://beforeitsnews.com/u-s-politics/2017/09/pumpkin-spiced-white-hot-chocolate-2537063.html
Duping Americans And Wasting Taxpayers’ Money,https://www.activistpost.com/2017/09/duping-americans-wasting-taxpayers-money.html
Nibiru Final Warning - ‘Just How Long Does Earth Have Left Before Planet X Doom’,http://beforeitsnews.com/u-s-politics/2017/10/nibiru-final-warning-just-how-long-does-earth-have-left-before-planet-x-doom-2537632.html
In 2000 The Simpsons Predicted The Donald Trump Presidency,http://dailybuzzlive.com/2000-simpsons-predicted-donald-trump-presidency/
Are Dems’ Late-Night Sock Puppets a Sign that the Fairness Doctrine Should be Restored?,http://beforeitsnews.com/u-s-politics/2017/10/are-dems-late-night-sock-puppets-a-sign-that-the-fairness-doctrine-should-be-restored-2537562.html
"Very Violent Reversal Before End of 2017, N.Korea Thinks US is Bluffing – James Rickards, Greg Hunter Video",http://beforeitsnews.com/opinion-conservative/2017/10/very-violent-reversal-before-end-of-2017-n-korea-thinks-us-is-bluffing-james-rickards-greg-hunter-video-3327266.html
"New Documents Show Pentagon Is Shipping Billions Worth Of Weapons To Terrorists In Syria, Trying To Cover Its Tracks",https://www.activistpost.com/2017/09/new-documents-show-pentagon-is-shipping-billions-worth-of-weapons-to-terrorists-in-syria-trying-to-cover-its-tracks.html
Mom Puts Glasses on Her Baby – Watch Her Face As She Sees Her Dad for the First Time,http://dailybuzzlive.com/mom-puts-glasses-baby-watch-face-sees-dad-first-time/
Bizarre Things That Just Don’t Make Sense About the Las Vegas Mass Shooting False Flag Event; Bizarre Things That Just Don’t Make Sense About The Las Vegas Mass Shooting False Flag Event,http://beforeitsnews.com/alternative/2017/10/bizarre-things-that-just-dont-make-sense-about-the-las-vegas-mass-shooting-false-flag-event-3558692.html
Lawrence Thomas Officially Makes Switch to Fullback,http://beforeitsnews.com/sports/2017/10/lawrence-thomas-officially-makes-switch-to-fullback-2701946.html
Las Vegas Shooting Makes Country Guitarist Change His Mind On Guns,http://beforeitsnews.com/u-s-politics/2017/10/las-vegas-shooting-makes-country-guitarist-change-his-mind-on-guns-2537201.html
Huge Triangle Shadow In The Sky In Louisiana,http://www.disclose.tv/news/huge_triangle_shadow_in_the_sky_in_louisiana/140427
Some Tips for Selecting The Best Flower Bouquet Online,http://beforeitsnews.com/entertainment/2017/09/some-tips-for-selecting-the-best-flower-bouquet-online-2670516.html
Kids & Fitness....Get the Kids Off the Couch & Have Some Fun!,http://beforeitsnews.com/sports/2017/09/kids-fitness-get-the-kids-off-the-couch-have-some-fun-2701071.html
North Korea's Other Threat: Why EMP Becomes An Extinction Level Event,http://www.disclose.tv/news/north_koreas_other_threat_why_emp_becomes_an_extinction_level_event/140397
Where Is President Trump’s Sense Of Compassion?,http://beforeitsnews.com/u-s-politics/2017/10/where-is-president-trumps-sense-of-compassion-2537449.html
"New Documents Show Pentagon Is Shipping Billions Worth Of Weapons To Terrorists In Syria, Trying To Cover Its Tracks",https://www.activistpost.com/2017/09/new-documents-show-pentagon-is-shipping-billions-worth-of-weapons-to-terrorists-in-syria-trying-to-cover-its-tracks.html
Jimmy Kimmel Weeps As He Talks About Shooting In His Hometown,http://beforeitsnews.com/u-s-politics/2017/10/jimmy-kimmel-weeps-as-he-talks-about-shooting-in-his-hometown-2537202.html
Mom Fights Back Home Invaders On Detroit’s West Side,http://dailybuzzlive.com/mom-fights-back-home-invaders-detroits-west-side/
Gatekeeper Invades The 312 Podcastto Preview the Blackhawks Season,http://beforeitsnews.com/sports/2017/10/gatekeeper-invades-the-312-podcastto-preview-the-blackhawks-season-2701850.html
Can You be Hacked by the World Around You?,https://www.activistpost.com/2017/10/can-hacked-world-around.html
"10/5 TRS-PNC Park: Bucs Win in '71, '79; Lose Four Playoffs (Dang Reds!); Tracy Fired",http://beforeitsnews.com/sports/2017/10/105-trs-pnc-park-bucs-win-in-71-79-lose-four-playoffs-dang-reds-tracy-fired-2702005.html
"Broken2th And Crystal Sun Release ""Castaliah""",http://beforeitsnews.com/entertainment/2017/09/broken2th-and-crystal-sun-release-castaliah-2670555.html
Audio Released of Hotel Worker Warning of Shooter BEFORE Vegas Massacre,https://www.activistpost.com/2017/10/audio-released-hotel-worker-warning-shooter-vegas-massacre.html
A Look at the Thursday Night Football Games,http://beforeitsnews.com/sports/2017/10/a-look-at-the-thursday-night-football-games-2702039.html
Women Absorb And Retain DNA From Every Man They Have Sex With,http://dailybuzzlive.com/women-absorb-retain-dna-every-man-sex/
Cowboys WR Dez Bryant - Team Done with Anthem Demonstations,http://beforeitsnews.com/sports/2017/09/cowboys-wr-dez-bryant-team-done-with-anthem-demonstations-2701525.html
FSU Opponent Preview: Wake Forest,http://beforeitsnews.com/sports/2017/09/fsu-opponent-preview-wake-forest-2701384.html
Ancient Papyrus Scroll Reveals How The Egyptian Pyramids Were Built,http://www.disclose.tv/news/ancient_papyrus_scroll_reveals_how_the_egyptian_pyramids_were_built/140374
2017 NLDS: Will Max Scherzer miss Game 1?,http://beforeitsnews.com/sports/2017/10/2017-nlds-will-max-scherzer-miss-game-1-2701754.html
The Shocking Carol Woods Coverup: POLICE ALTER RECORDS + archive 11 Sept. 2017,http://beforeitsnews.com/scandals/2017/09/the-shocking-carol-woods-coverup-police-alter-records-archive-11-sept-2017-2437313.html
Tailgate - Jaguars vs Jets,http://beforeitsnews.com/sports/2017/10/tailgate-jaguars-vs-jets-2701814.html
2017 Get ‘em or Don’t Sweat ‘em - Week 4,http://beforeitsnews.com/sports/2017/09/2017-get-em-or-dont-sweat-em-week-4-2701063.html
Trump Administration Urges Congress To Renew Foreign Intelligence Surveillance Act (FISA),https://www.activistpost.com/2017/09/trump-admin-congress-renew-fisa.html
John Elway Says That It’s Time to Take the Politics OUT of Football,http://beforeitsnews.com/u-s-politics/2017/09/john-elway-says-that-its-time-to-take-the-politics-out-of-football-2536909.html
"Employers Can Now Refuse to Pay for Birth Control, Thanks To Trump",http://beforeitsnews.com/u-s-politics/2017/10/employers-can-now-refuse-to-pay-for-birth-control-thanks-to-trump-2537484.html
Teacher Told Students They Were ‘Too Dark-Skinned’ To Play Lincoln,http://beforeitsnews.com/u-s-politics/2017/09/teacher-told-students-they-were-too-dark-skinned-to-play-lincoln-2536920.html
"Strange Object Spotted Over Newfoundland, Canada",http://www.disclose.tv/news/strange_object_spotted_over_newfoundland_canada/140381
Secrets of the Super Elements,http://beforeitsnews.com/entertainment/2017/09/secrets-of-the-super-elements-2670573.html
Wall Street Vs. Kremlin: Who Really Runs The White House?,https://www.activistpost.com/2017/10/wall-street-vs-kremlin-really-runs-white-house.html
Rich Would Benefit Most From Trump Tax Cut Plan: Policy Group,http://beforeitsnews.com/u-s-politics/2017/09/rich-would-benefit-most-from-trump-tax-cut-plan-policy-group-2537054.html
Hungary’s “Wall” Versus the U.S. “Wall”,https://www.activistpost.com/2017/10/hungarys-wall-versus-u-s-wall-whats-difference.html
"Ray Says He Was Praying, Not Protesting",http://beforeitsnews.com/sports/2017/09/ray-says-he-was-praying-not-protesting-2701397.html
"Kneeling For The National Anthem Isn’t Disrespectful, It’s Patriotic",http://beforeitsnews.com/u-s-politics/2017/09/kneeling-for-the-national-anthem-isnt-disrespectful-its-patriotic-2536733.html
"The ‘Sweet Season’ in Coming Up, But with Good Habits and Careful Monitoring, Teeth Problems can be Avoided, According to Gilroy Dentist",http://beforeitsnews.com/entertainment/2017/09/the-sweet-season-in-coming-up-but-with-good-habits-and-careful-monitoring-teeth-problems-can-be-avoided-according-to-gilroy-dentist-2670614.html
War on Cash Backfires on India’s Economy,https://www.activistpost.com/2017/09/war-cash-backfires-indias-economy.html
"Trump Threatens WW3 ""Reviewing Plans To Send Weapons To Ukraine""",https://www.activistpost.com/2017/09/trump-threatens-ww3-reviewing-plans-send-weapons-ukraine-russia-run-massive-military-drill.html
This High School Is Threatening To Ban Players Who Kneel During Anthem,http://beforeitsnews.com/u-s-politics/2017/10/this-high-school-is-threatening-to-ban-players-who-kneel-during-anthem-2537184.html
Republican Wants Women To Be ‘Traditional Homemakers And Family Wives’,http://beforeitsnews.com/u-s-politics/2017/10/republican-wants-women-to-be-traditional-homemakers-and-family-wives-2537625.html
Helicopter Money' Coming Michael Pento,http://beforeitsnews.com/u-s-politics/2017/10/helicopter-money-coming-michael-pento-2537592.html
11 Commission Witnesses: The “Minders”,https://www.activistpost.com/2017/09/intimidation-911-commission-witnesses-minders.html
Video Released of Elderly German Captive Beheaded by Islamic State,http://dailybuzzlive.com/video-released-elderly-german-captive-beheaded-islamic-state/
The Yankees Live To See Another Day!,http://beforeitsnews.com/sports/2017/10/the-yankees-live-to-see-another-day-2702320.html
‘Fixed Upper’ Stars Announce Final Season - really,http://beforeitsnews.com/u-s-politics/2017/09/fixed-upper-stars-announce-final-season-really-2536845.html
"U.S. to Cut Embassy Staff, warn travelers from Cuba",http://beforeitsnews.com/u-s-politics/2017/09/u-s-to-cut-embassy-staff-warn-travelers-from-cuba-2537001.html
Las Vegas: Bombshell Video Shows Second Shooter During Vegas Massacre The Alex Jones Channel,http://beforeitsnews.com/blogging-citizen-journalism/2017/10/las-vegas-bombshell-video-shows-second-shooter-during-vegas-massacre-the-alex-jones-channel-2577148.html
California Seeks Ban On Fossil Fuel Cars Laying The Groundwork To Ban Humans From The Road,https://www.activistpost.com/2017/09/california-ban-on-diesel-fuel-cars-laying-the-ground-work-to-ban-humans-from-the-road.html
NFL Malcontent Marshawn Lynch Wears Anti-Trump Shirt to Game,http://beforeitsnews.com/u-s-politics/2017/10/nfl-malcontent-marshawn-lynch-wears-anti-trump-shirt-to-game-2537167.html
Blue Martinez,http://beforeitsnews.com/entertainment/2017/09/blue-martinez-2670571.html
Avid Hunter Don Jr. On Gun Silencers: ‘It's Just A Great Instrument’,http://beforeitsnews.com/u-s-politics/2017/10/avid-hunter-don-jr-on-gun-silencers-its-just-a-great-instrument-2537262.html
5 Things to Think About,https://www.activistpost.com/2017/10/catalan-independence-5-things-think.html
The Castration Cure,http://beforeitsnews.com/entertainment/2017/09/the-castration-cure-2670541.html
Streaming Defenses (2016): Week 4: Which Offense Do We Want To Exploit?,http://beforeitsnews.com/sports/2017/09/streaming-defenses-2016-week-4-which-offense-do-we-want-to-exploit-2701153.html
Judge Awards Alleged Rapist With Parental Rights,http://beforeitsnews.com/u-s-politics/2017/10/judge-awards-alleged-rapist-with-parental-rights-2537657.html
Just Shut Up & Play Some Damn Baseball!!,http://beforeitsnews.com/sports/2017/09/just-shut-up-play-some-damn-baseball-2701059.html
New Oregon Law will Help Facilitate the Sale of Industrial Hemp Products,https://www.activistpost.com/2017/10/new-oregon-law-will-help-facilitate-sale-industrial-hemp-products-2.html
Hangover Win,http://beforeitsnews.com/sports/2017/09/hangover-win-2701115.html
50 & The Inspirational Journey Of Aaron Judge,http://beforeitsnews.com/sports/2017/09/50-the-inspirational-journey-of-aaron-judge-2701148.html
Quantum Computer in a Nutshell,http://beforeitsnews.com/entertainment/2017/09/quantum-computer-in-a-nutshell-2670552.html
2017 Fantasy Football Kicker Rankings - Week 5,http://beforeitsnews.com/sports/2017/10/2017-fantasy-football-kicker-rankings-week-5-2701896.html
Come Together,http://beforeitsnews.com/sports/2017/09/come-together-2701180.html
Game Photos: Michigan at Purdue,http://beforeitsnews.com/sports/2017/09/game-photos-michigan-at-purdue-2701074.html
Can Boston Red Sox Recover from Epic Beatdown by Houston Astros?,http://beforeitsnews.com/u-s-politics/2017/10/can-boston-red-sox-recover-from-epic-beatdown-by-houston-astros-2537429.html
Freedom Exists Under Natural Law,https://www.activistpost.com/2017/10/freedom-exists-natural-law.html
House Republicans Answers ‘Why Does Tax Reform Matter to You?’ in new video,http://beforeitsnews.com/u-s-politics/2017/09/house-republicans-answers-why-does-tax-reform-matter-to-you-in-new-video-2536863.html
A Poor Chinese Intern May Have Been Forced To Make Your Branded Laptop,http://beforeitsnews.com/u-s-politics/2017/10/a-poor-chinese-intern-may-have-been-forced-to-make-your-branded-laptop-2537601.html
Trump Fans Are Collecting The Personal Info Of Thousands On The Left,http://beforeitsnews.com/u-s-politics/2017/09/trump-fans-are-collecting-the-personal-info-of-thousands-on-the-left-2536783.html
New York Shake Shack to Test Out Robotic Personnel in Blow to $15 Minimum Wage,http://beforeitsnews.com/u-s-politics/2017/10/new-york-shake-shack-to-test-out-robotic-personnel-in-blow-to-15-minimum-wage-2537335.html
2017 Fantasy Football Quarterback Rankings - Week 5,http://beforeitsnews.com/sports/2017/10/2017-fantasy-football-quarterback-rankings-week-5-2701791.html
"For Second Week in row, Jets Youngsters Shine",http://beforeitsnews.com/sports/2017/10/for-second-week-in-row-jets-youngsters-shine-2701701.html
Eric Trump National anthem should be kept sacred,http://beforeitsnews.com/u-s-politics/2017/10/eric-trump-national-anthem-should-be-kept-sacred-helen-sarah-helen-sarah-2537079.html
Eric Trump National anthem should be kept sacred,http://beforeitsnews.com/u-s-politics/2017/10/eric-trump-national-anthem-should-be-kept-sacred-helen-sarah-helen-sarah-2537079.html
"A Veteran Asks, “What’s Worse, a Kneeling Millionaire or 300,000 Vets Neglected to Death?”",https://www.activistpost.com/2017/09/veteran-asks-whats-worse-kneeling-millionaire-300000-vets-neglected-death.html
Hand Feeding Humming Birds – AMAZING!,http://dailybuzzlive.com/hand-feeding-humming-birds-amazing/
"Las Vegas Bombshell: Video Appears to Show Muzzle-Flash From 4th Floor, Not 32nd (Video)",http://beforeitsnews.com/prophecy/2017/10/las-vegas-bombshell-video-appears-to-show-muzzle-flash-from-4th-floor-not-32nd-video-2494540.html
Amazon Rising,http://beforeitsnews.com/entertainment/2017/10/amazon-rising-2670647.html
"Why Don't You Just Hand The Indians The Trophy, Joe?",http://beforeitsnews.com/sports/2017/10/why-dont-you-just-hand-the-indians-the-trophy-joe-2702168.html
WARNING: Italian SUPERVOLCANO on the brink of ERUPTION,http://www.disclose.tv/news/warning_italian_supervolcano_on_the_brink_of_eruption/140334
"10/3 TRS-PNC Park Era: Bucs Win a Couple, Lose a Couple Playoff Games; Roberto & Pops Finales & Game Stories",http://beforeitsnews.com/sports/2017/10/103-trs-pnc-park-era-bucs-win-a-couple-lose-a-couple-playoff-games-roberto-pops-finales-game-stories-2701793.html
Vegas Mass Shooter Was Verbally Abusive Towards Girlfriend,http://beforeitsnews.com/u-s-politics/2017/10/vegas-mass-shooter-was-verbally-abusive-towards-girlfriend-2537324.html
Chicago Cubs accomplish rare franchise feat with NL Central win,http://beforeitsnews.com/sports/2017/09/chicago-cubs-accomplish-rare-franchise-feat-with-nl-central-win-2701341.html
PRESIDENT TRUMP says: Las Vegas shooting - Live updates,http://beforeitsnews.com/u-s-politics/2017/10/president-trump-says-las-vegas-shooting-live-updates-2537187.html
Nowhere to Go but Up?,http://beforeitsnews.com/sports/2017/09/nowhere-to-go-but-up-2701080.html
"10/8: HBD Tom, Donie, Danny, Catfish & Spanky; Hans #2; Cannonball Coming",http://beforeitsnews.com/sports/2017/10/108-hbd-tom-donie-danny-catfish-spanky-hans-2-cannonball-coming-2702239.html
Ravens Again Abandon Running Game,http://beforeitsnews.com/sports/2017/10/ravens-again-abandon-running-game-2701922.html
Yankee Burn,http://beforeitsnews.com/sports/2017/10/yankee-burn-2702095.html
Police Are Looking For These 2 Creepy Masked Figures That Appeared In The Woods,http://dailybuzzlive.com/police-looking-2-creepy-masked-figures-appeared-woods/
"Bali volcano on brink of eruption for the first time since 50 years, evacuations ordered",http://www.disclose.tv/news/bali_volcano_on_brink_of_eruption_for_the_first_time_since_50_year_evacuations_ordered/140357
Sold Out: The Underground Economy of Supreme Resellers,http://beforeitsnews.com/entertainment/2017/09/sold-out-the-underground-economy-of-supreme-resellers-2670568.html
Jacoby Jones to Retire a Raven,http://beforeitsnews.com/sports/2017/09/jacoby-jones-to-retire-a-raven-2701446.html
Ravens Lay Another Egg,http://beforeitsnews.com/sports/2017/10/ravens-lay-another-egg-2701717.html
"Ray Says He Was Praying, Not Protesting",http://beforeitsnews.com/sports/2017/09/ray-says-he-was-praying-not-protesting-2701397.html
Trump’s Cabinet Travels In Style At The Expense Of Tax Payers,http://beforeitsnews.com/u-s-politics/2017/10/trumps-cabinet-travels-in-style-at-the-expense-of-tax-payers-2537636.html
"After Alleged 'Moron' Remark, Tillerson Strokes Trump's Ego",http://beforeitsnews.com/u-s-politics/2017/10/after-alleged-moron-remark-tillerson-strokes-trumps-ego-2537294.html
California Clothing Store Owner’s Trump as Nazi Billboard Backfires Big Time,http://beforeitsnews.com/u-s-politics/2017/10/california-clothing-store-owners-trump-as-nazi-billboard-backfires-big-time-2537560.html
How to Make Money While Playing Video Games Online?,http://beforeitsnews.com/sports/2017/09/how-to-make-money-while-playing-video-games-online-2701288.html
Mommy Signed Her Up For Preschool. Her ‘Rundown’ Of The Day Has The Internet In Laughter; Mommy Signed Her Up For Preschool. Her ‘Rundown’ Of The Day Has The Internet In Laughter,http://dailybuzzlive.com/mommy-signed-her-up-for-preschool/
"9/29 From the 50s Forward: HBD Ken, Teke Takes Two, ALou #2, Browns, 6-In-A-Row, Cutch Walks It Off, Giants Finale",http://beforeitsnews.com/sports/2017/09/929-from-the-50s-forward-hbd-ken-teke-takes-two-alou-2-browns-6-in-a-row-cutch-walks-it-off-giants-finale-2701480.html
Financialization and The Destruction of the Real Economy,https://www.activistpost.com/2017/09/financialization-destruction-real-economy.html
Ravens @ Raiders - Wednesday,http://beforeitsnews.com/sports/2017/10/ravens-raiders-wednesday-2-2701960.html
Las Vegas Massacre: Thought Provoking – ‘No Conclusive Evidence or Information About This Shooting’,http://beforeitsnews.com/opinion-conservative/2017/10/las-vegas-massacre-thought-provoking-no-conclusive-evidence-or-information-about-this-shooting-3327562.html
SpaceX: BFR Will go from any city to any other city on Earth in under an hour,http://beforeitsnews.com/u-s-politics/2017/09/spacex-bfr-will-go-from-any-city-to-any-other-city-on-earth-in-under-an-hour-2536983.html
Trickle Down Taxation - A.F. Branco,http://beforeitsnews.com/u-s-politics/2017/09/trickle-down-taxation-a-f-branco-2536927.html
Trump On Gun Violence: ‘We’re Not Going To Talk About That’,http://beforeitsnews.com/u-s-politics/2017/10/trump-on-gun-violence-were-not-going-to-talk-about-that-2537298.html
Are These Radiation Detectors?,https://www.activistpost.com/2017/10/mysterious-dhs-towers-nyc-radiation-detectors.html
"10/1 Happenings: HBD Specs, Jim & Vance; Max Swipes 51; O'Connell Deal; Danny Quits & More...",http://beforeitsnews.com/sports/2017/10/101-happenings-hbd-specs-jim-vance-max-swipes-51-oconnell-deal-danny-quits-more-2701630.html
Trump to visit Puerto Rico on Tuesday,http://beforeitsnews.com/u-s-politics/2017/09/trump-to-visit-puerto-rico-on-tuesday-2536771.html
"Neo-Nazi Dennis Mothersbaugh Proudly Wears ‘God, Guns & Trump’ T-Shirt",http://beforeitsnews.com/u-s-politics/2017/10/neo-nazi-dennis-mothersbaugh-proudly-wears-god-guns-trump-t-shirt-2537485.html
"11 Gave Us the Police State With the ""Patriot"" Act, After Vegas Get Ready for ""USA Liberty"" Act",https://www.activistpost.com/2017/10/911-gave-us-police-state-patriot-act-vegas-get-ready-usa-liberty-act.html
UN Allegedly Nixed A Report That Predicted The Rohingya Crisis,http://beforeitsnews.com/u-s-politics/2017/10/un-allegedly-nixed-a-report-that-predicted-the-rohingya-crisis-2537360.html
Ravens’ Problems Start at the Top,http://beforeitsnews.com/sports/2017/10/ravens-problems-start-at-the-top-2701720.html
Lambeau Field has become a House of Horrors for the Chicago Bears,http://beforeitsnews.com/sports/2017/10/lambeau-field-has-become-a-house-of-horrors-for-the-chicago-bears-2701748.html
Now A Sitcom About An Illegal Family!!!,http://beforeitsnews.com/u-s-politics/2017/09/now-a-sitcom-about-an-illegal-family-2536784.html
Podcast - @Hokiesmash_ASD & @TalkinACCSports talk FBI investigation and ACC football\network with @AnishESPN,http://beforeitsnews.com/sports/2017/09/podcast-hokiesmash_asd-talkinaccsports-talk-fbi-investigation-and-acc-footballnetwork-with-anishespn-2701345.html
The Durham Bulls in 2017 - Part 3 - The Hitters,http://beforeitsnews.com/sports/2017/10/the-durham-bulls-in-2017-part-3-the-hitters-2702102.html
