link_name,status_link
Multiple Shooters in Las Vegas! Paddock a Patsy! Proof: 2nd Shooter Remains At-Large After Las Vegas Massacre +Videos,http://beforeitsnews.com/terrorism/2017/10/multiple-shooters-in-las-vegas-paddock-a-patsy-proof-2nd-shooter-remains-at-large-after-las-vegas-massacre-videos-2460271.html
Strange Dome-Like Formations Found On Mars,http://www.disclose.tv/news/strange_domelike_formations_found_on_mars/140438
"Dems Call For Action Against Guns, Not Just ‘Thoughts And Prayers’",http://beforeitsnews.com/u-s-politics/2017/10/dems-call-for-action-against-guns-not-just-thoughts-and-prayers-2537208.html
Blackhawks Roster Breakdown: Defense,http://beforeitsnews.com/sports/2017/09/blackhawks-roster-breakdown-defense-2701511.html
11 & US Govt Has Proven They ‘Hate Our Freedom’ Just As Much as Terrorists,https://www.activistpost.com/2017/09/16-years-911-us-govt-proven-hate-freedom-just-much-terrorists.html
Entertainment,http://beforeitsnews.com/entertainment/2017/09/the-ai-race-2670517.html
Celebrities Tweeting Geeky Photos To Help Raise Funds For Puerto Rico,http://beforeitsnews.com/u-s-politics/2017/10/celebrities-tweeting-geeky-photos-to-help-raise-funds-for-puerto-rico-2537094.html
Egypt Qualifies For World Cup In 27 Years Amidst Political Instability,http://beforeitsnews.com/u-s-politics/2017/10/egypt-qualifies-for-world-cup-in-27-years-amidst-political-instability-2537603.html
White House Press Briefing 9/25/17 [Live Stream],http://beforeitsnews.com/u-s-politics/2017/09/white-house-press-briefing-92517-live-stream-2536705.html
Yiannopoulos And Spencer Kicked Out Of Bar For Making The Nazi Salute,http://beforeitsnews.com/u-s-politics/2017/10/yiannopoulos-and-spencer-kicked-out-of-bar-for-making-the-nazi-salute-2537546.html
How To Learn Faster,http://beforeitsnews.com/u-s-politics/2017/09/how-to-learn-faster-2537003.html
Liberal Gun Control Ideas Fall Apart Quickly,http://beforeitsnews.com/u-s-politics/2017/10/liberal-gun-control-ideas-fall-apart-quickly-2537594.html
"Ron Paul on Trump, Anarchism & the AltRight",https://www.activistpost.com/2017/09/ron-paul-trump-anarchism-altright.html
Yankees and Red Sox Both Head Home in Deep Holes Following Road Losses,http://beforeitsnews.com/u-s-politics/2017/10/yankees-and-red-sox-both-head-home-in-deep-holes-following-road-losses-2537499.html
"Food Truck Giving Free Food to Hurricane Workers, Kicked Out of Town for Not Having a Permit",https://www.activistpost.com/2017/09/food-truck-giving-free-food-hurricane-workers-kicked-town-not-permit.html
2017 Fantasy Football IDP Rankings - Week 4,http://beforeitsnews.com/sports/2017/09/2017-fantasy-football-idp-rankings-week-4-2701374.html
Smart Devices Are Snitching on Owners and Rewriting the Criminal Justice System,https://www.activistpost.com/2017/10/smart-devices-are-snitching-on-owners-and-rewriting-the-criminal-justice-system.html
Will Security Measures Change In Response To Mass Shootings?,http://beforeitsnews.com/u-s-politics/2017/10/will-security-measures-change-in-response-to-mass-shootings-2537191.html
"President Donald Trump’s Schedule for Saturday, September 30, 2017",http://beforeitsnews.com/u-s-politics/2017/09/president-donald-trumps-schedule-for-saturday-september-30-2017-2537021.html
Austria's Islamophobic 'Burqa Ban' Criminalizes Muslim Women,http://beforeitsnews.com/u-s-politics/2017/10/austrias-islamophobic-burqa-ban-criminalizes-muslim-women-2537120.html
Broncos President of Football Ops John Elway: “I Believe in Standing for the National Anthem”,http://beforeitsnews.com/sports/2017/09/broncos-president-of-football-ops-john-elway-i-believe-in-standing-for-the-national-anthem-2701206.html
Japanese Journalist Died After Working 159 Hours Of Overtime,http://beforeitsnews.com/u-s-politics/2017/10/japanese-journalist-died-after-working-159-hours-of-overtime-2537402.html
Celebrities Tweeting Geeky Photos To Help Raise Funds For Puerto Rico,http://beforeitsnews.com/u-s-politics/2017/10/celebrities-tweeting-geeky-photos-to-help-raise-funds-for-puerto-rico-2537094.html
Dirty Gold War,http://beforeitsnews.com/entertainment/2017/09/dirty-gold-war-2670511.html
Three Streaming Options For The Final Weekend Of The 2017 Season,http://beforeitsnews.com/sports/2017/09/three-streaming-options-for-the-final-weekend-of-the-2017-season-2701504.html
"Donald Trump Threatens North Korea On Twitter, NK Foreign Minister Responds ""You Declared War""",https://www.activistpost.com/2017/09/donald-trump-threatens-north-korea-twitter-nk-foreign-minister-responds-declared-war.html
"Smart Devices are Listening to (and Saving) Everything You Say, Here’s How to Stop It",https://www.activistpost.com/2017/10/smart-devices-listening-saving-everything-say-heres-stop.html
Week 4 Rankings (2017): Top 20 Tight Ends: Does Anyone Want To Emerge As Trustworthy?,http://beforeitsnews.com/sports/2017/09/week-4-rankings-2017-top-20-tight-ends-does-anyone-want-to-emerge-as-trustworthy-2701233.html
Will A Strong Finish/Postseason Keep Kris Bryant As A 2018 1st Round Pick?,http://beforeitsnews.com/sports/2017/09/will-a-strong-finishpostseason-keep-kris-bryant-as-a-2018-1st-round-pick-2701412.html
Trump Is Preparing to Kill Kim Jong-un - Oh My God! Breaking News TV,http://beforeitsnews.com/u-s-politics/2017/09/trump-is-preparing-to-kill-kim-jong-un-oh-my-god-breaking-news-tv-breaking-news-tv-2536942.html
"Journalist Travels To North Korea, Brings Back Photos Very Different From MSM",https://www.activistpost.com/2017/09/journalist-travels-to-north-korea-brings-back-photos-very-different-from-msm.html
Trump Delivers Speech at National Association of Manufacturers Conference [Live Stream],http://beforeitsnews.com/u-s-politics/2017/09/trump-delivers-speech-at-national-association-of-manufacturers-conference-live-stream-2536994.html
Ravens vs. Steelers - Thursday,http://beforeitsnews.com/sports/2017/09/ravens-vs-steelers-thursday-3-2701449.html
Paddock Shot Security Guard BEFORE Mass Shooting,https://www.activistpost.com/2017/10/vegas-cops-change-story-paddock-shot-security-guard-mass-shooting.html
Jets add Familiar Face to Practice Squad in LB Freddie Bishop,http://beforeitsnews.com/sports/2017/10/jets-add-familiar-face-to-practice-squad-in-lb-freddie-bishop-2701956.html
Jake Arrieta admits he’s still not 100 percent,http://beforeitsnews.com/sports/2017/09/jake-arrieta-admits-hes-still-not-100-percent-2701315.html
Pro-Palestinian Activists Targeted With Racist Posters At Colleges,http://beforeitsnews.com/u-s-politics/2017/09/pro-palestinian-activists-targeted-with-racist-posters-at-colleges-2537011.html
Plastic Surgery Fails – Just DON’T Do It!!,http://dailybuzzlive.com/plastic-surgery-fails-just-dont-do-it/
Train Stations to use Facial Recognition and Palm Vein Scanners for Payment,https://www.activistpost.com/2017/09/train-stations-use-facial-recognition-palm-vein-scanners-payment.html
Smart Billboards Target Individual Motorists and Spy on License Plates and Cellphones,https://www.activistpost.com/2017/09/smart-billboards-target-individual-motorists-spy-license-plates-cellphones.html
Public Version Of Crude Trump-Howard Stern Interviews Hit By DCMA,http://beforeitsnews.com/u-s-politics/2017/09/public-version-of-crude-trump-howard-stern-interviews-hit-by-dcma-2536979.html
"North Korea Prepares To Test Missile Which Can Reach US, Says Russia",http://beforeitsnews.com/u-s-politics/2017/10/north-korea-prepares-to-test-missile-which-can-reach-us-says-russia-2537486.html
3.4 magnitude earthquake in North Korea,http://www.disclose.tv/news/a_34_magnitude_earthquake_in_north_korea_believed_to_be_caused_by_a_nuclear_test/140364
"Accused of War Crimes, Saudi Arabia Investigates Themselves and Find No Wrongdoing",https://www.activistpost.com/2017/09/saudi-arabia-investigates-own-war-crimes-allegations.html
"Google Announces Awesome, Must See Technology [Video]",http://beforeitsnews.com/u-s-politics/2017/10/google-announces-awesome-must-see-technology-video-2537405.html
Everything’s About to Change: You’ll Be Shocked by What the Bankers Have Planned—Insider Tells All,http://beforeitsnews.com/economy/2017/10/how-to-opt-out-what-vile-bankers-want-kept-secret-has-been-leaked-by-insider-2913644.html
Police Are Looking For These 2 Creepy Masked Figures That Appeared In The Woods,http://dailybuzzlive.com/police-looking-2-creepy-masked-figures-appeared-woods/
Jets Dinged up on Defense,http://beforeitsnews.com/sports/2017/10/jets-dinged-up-on-defense-2702132.html
Columbus day 2017: Trump's praise of Columbus omits dark history,http://beforeitsnews.com/u-s-politics/2017/10/columbus-day-2017-trumps-praise-of-columbus-omits-dark-history-2537630.html
"Jeter Fires 4 More, Mattingly Could Be Next",http://beforeitsnews.com/sports/2017/09/jeter-fires-4-more-mattingly-could-be-next-2701563.html
"Wednesday: Cool Chad v Gabriel Ynoa, Lineup, Notes",http://beforeitsnews.com/sports/2017/09/wednesday-cool-chad-v-gabriel-ynoa-lineup-notes-2701311.html
Syrian War - How America Shot Itself in the Foot,https://www.activistpost.com/2017/10/syrian-war-how-america-shot-itself-in-the-foot.html
"10/1 TRS-PNC Era: Wildcard Win, TRS Closes, Freddy Takes Crown, Locke's 1st Win & More",http://beforeitsnews.com/sports/2017/10/101-trs-pnc-era-wildcard-win-trs-closes-freddy-takes-crown-lockes-1st-win-more-2701629.html
"9/27 TRS-PNC Era: Bucs Clinch In '70 & '92, HBD Pedro & Vin, Giles Goes Wild, Game Stories",http://beforeitsnews.com/sports/2017/09/927-trs-pnc-era-bucs-clinch-in-70-92-hbd-pedro-vin-giles-goes-wild-game-stories-2701266.html
Activist Sued by Local Government for Open Records Request on Surveillance,https://www.activistpost.com/2017/10/activist-sued-local-government-open-records-request-surveillance.html
Buy ‘Em or Deny ‘Em: Is Chris Johnson A Worthy Fantasy Option?,http://beforeitsnews.com/sports/2017/09/buy-em-or-deny-em-is-chris-johnson-a-worthy-fantasy-option-2701279.html
Melania And Donald Think The White House Is Like A Jail,http://beforeitsnews.com/u-s-politics/2017/10/melania-and-donald-think-the-white-house-is-like-a-jail-2537543.html
PreaseasonBlackhawks vs Bruins1-0 Shutout Win Recap,http://beforeitsnews.com/sports/2017/10/preaseasonblackhawks-vs-bruins1-0-shutout-win-recap-2701643.html
Best Ghost Footage Taken On Hospital Security Camera,http://dailybuzzlive.com/best-ghost-footage-taken-hospital-security-camera/
Black Students Kicked Out Of Team For #TakeAKnee,http://beforeitsnews.com/u-s-politics/2017/10/black-students-kicked-out-of-team-for-takeaknee-2537075.html
Post-Game Snapshot: Jaguars 44 Ravens 7,http://beforeitsnews.com/sports/2017/09/post-game-snapshot-jaguars-44-ravens-7-2701112.html
Dave Doeren has finally gotten that signature win,http://beforeitsnews.com/sports/2017/10/dave-doeren-has-finally-gotten-that-signature-win-2-2701969.html
Facebook Merges With The Deep State To Manipulate Elections,https://www.activistpost.com/2017/10/facebook-merges-deep-state-manipulate-elections.html
"Thursday: Pirates at Nats, Nova v Edwin Jackson, Lineup, Notes",http://beforeitsnews.com/sports/2017/09/thursday-pirates-at-nats-nova-v-edwin-jackson-lineup-notes-2701444.html
Las Vegas Mass Shooting Eyewitness: Crazy Women Warned Concert Goers That Everyone Was Going To Die 45 Minutes Before Shooting,http://beforeitsnews.com/alternative/2017/10/las-vegas-mass-shooting-eyewitness-crazy-women-warned-concert-goers-that-everyone-was-going-to-die-45-minutes-before-shooting-3558426.html
Wait... I Agree With David Ortiz?!,http://beforeitsnews.com/sports/2017/09/wait-i-agree-with-david-ortiz-2701381.html
Can Ravens Win 7th of 9 vs. Steelers?,http://beforeitsnews.com/sports/2017/09/can-ravens-win-7th-of-9-vs-steelers-2701568.html
"Man Tries To Avoid Paying Hotel Bills, Gets Stuck On Telephone Wires",http://beforeitsnews.com/u-s-politics/2017/10/man-tries-to-avoid-paying-hotel-bills-gets-stuck-on-telephone-wires-2537418.html
Kalashnikov Unveils New Anti-Drone Weapon,https://www.activistpost.com/2017/09/kalashnikov-unveils-new-anti-drone-weapon.html
"Carmen Cruz, Mayor of San Juan Is A “Godsend” For Puerto Ricans",http://beforeitsnews.com/u-s-politics/2017/10/carmen-cruz-mayor-of-san-juan-is-a-godsend-for-puerto-ricans-2537166.html
2017 Get ‘em or Don’t Sweat ‘em - Week 4,http://beforeitsnews.com/sports/2017/09/2017-get-em-or-dont-sweat-em-week-4-2701063.html
256 Years Old Man Breaks The Silence Before His Death And Reveals SHOCKING Secrets To The World,http://dailybuzzlive.com/256-years-old-man-reveals-shocking-secrets/
#NFLBurnnotice Mueller Cruise All in one day!!!,http://beforeitsnews.com/entertainment/2017/09/nflburnnotice-mueller-cruise-all-in-one-day-2670605.html
Hannity Continues Smack Down on Maddow in 9 pm News War,http://beforeitsnews.com/u-s-politics/2017/09/hannity-continues-smack-down-on-maddow-in-9-pm-news-war-2536896.html
NFL Players Kneel Despite Trump's Fresh Call For Protests To End,http://beforeitsnews.com/u-s-politics/2017/10/nfl-players-kneel-despite-trumps-fresh-call-for-protests-to-end-2537118.html
"Russell Witcher talks about 'Coming Out' memoir, healing balm of sacred music",http://beforeitsnews.com/entertainment/2017/09/russell-witcher-talks-about-coming-out-memoir-healing-balm-of-sacred-music-2670490.html
G-Fans Bid Cain Adieu,http://beforeitsnews.com/sports/2017/09/g-fans-bid-cain-adieu-2701597.html
"10/2 Games: Bucs Clinch In '74, Boston Evens WS, Goose & Teke at 72, Triple-Bill, Game Stories",http://beforeitsnews.com/sports/2017/10/102-games-bucs-clinch-in-74-boston-evens-ws-goose-teke-at-72-triple-bill-game-stories-2701700.html
"10/1 Happenings: HBD Specs, Jim & Vance; Max Swipes 51; O'Connell Deal; Danny Quits & More...",http://beforeitsnews.com/sports/2017/10/101-happenings-hbd-specs-jim-vance-max-swipes-51-oconnell-deal-danny-quits-more-2701630.html
Save The Children - A.F. Branco Cartoon,http://beforeitsnews.com/u-s-politics/2017/09/save-the-children-a-f-branco-cartoon-2536995.html
18-Year-Old Reportedly Raped After Arrest By On-Duty NYPD Officers,http://beforeitsnews.com/u-s-politics/2017/10/18-year-old-reportedly-raped-after-arrest-by-on-duty-nypd-officers-2537141.html
Why Are Universities Becoming Targets For Racist Attacks?,http://beforeitsnews.com/u-s-politics/2017/10/why-are-universities-becoming-targets-for-racist-attacks-2537175.html
Report: Jets Sign Running Back/Return man Travaris Cadet,http://beforeitsnews.com/sports/2017/09/report-jets-sign-running-backreturn-man-travaris-cadet-2701219.html
Bottom 5 Yinzer-isms,http://beforeitsnews.com/sports/2017/09/bottom-5-yinzer-isms-2701482.html
Bucs Go Quietly Into the Night 6-1,http://beforeitsnews.com/sports/2017/09/bucs-go-quietly-into-the-night-6-1-2701538.html
Guilty,http://beforeitsnews.com/sports/2017/10/guilty-2701917.html
"Forte, Leggett Out, Shell Doubtful - Injury Report",http://beforeitsnews.com/sports/2017/09/forte-leggett-out-shell-doubtful-injury-report-2701522.html
Streaming Defenses (2016): Week 4: Which Offense Do We Want To Exploit?,http://beforeitsnews.com/sports/2017/09/streaming-defenses-2016-week-4-which-offense-do-we-want-to-exploit-2701153.html
Passing Game Film Review - Good McCown - Week 3 (Dolphins),http://beforeitsnews.com/sports/2017/09/passing-game-film-review-good-mccown-week-3-dolphins-2701326.html
Florida State’s season is in a heap of trouble.,http://beforeitsnews.com/sports/2017/09/florida-states-season-is-in-a-heap-of-trouble-2-2701612.html
"President Donald Trump’s Schedule for Monday, October 10, 2017",http://beforeitsnews.com/u-s-politics/2017/10/president-donald-trumps-schedule-for-monday-october-10-2017-2537593.html
"Post-Game Recap: Jets beat Browns, 17-14",http://beforeitsnews.com/sports/2017/10/post-game-recap-jets-beat-browns-17-14-2702281.html
Texans’ Player Donates First Game Check To Workers Effected By Harvey,http://beforeitsnews.com/u-s-politics/2017/09/texans-player-donates-first-game-check-to-workers-effected-by-harvey-2536962.html
Blackhawks at Detroit - 4-2 Win Recap,http://beforeitsnews.com/sports/2017/09/blackhawks-at-detroit-4-2-win-recap-2701476.html
The Ditch List: Breaking Down Four Players It May Be Time To Cut Bait On,http://beforeitsnews.com/sports/2017/09/the-ditch-list-breaking-down-four-players-it-may-be-time-to-cut-bait-on-2701049.html
Evidence Emerges Showing FBI Was Behind 2015 ISIS Terror Attack in Texas,https://www.activistpost.com/2017/10/evidence-emerges-showing-fbi-was-behind-2015-isis-terror-attack-in-texas.html
U.S. Government Announces 21 States Had Hackers Target Their System,https://www.activistpost.com/2017/09/us-government-announces-21-states-hackers-target-system-leaves-dhs-hackers.html
2017 Fantasy Football Tight End Rankings - Week 4,http://beforeitsnews.com/sports/2017/09/2017-fantasy-football-tight-end-rankings-week-4-2701248.html
Helicopter Money' Coming Michael Pento,http://beforeitsnews.com/u-s-politics/2017/10/helicopter-money-coming-michael-pento-2537592.html
Fundamental And Constitutional Rights Negated In The Realm of Totalitarian Corporatocracy,https://www.activistpost.com/2017/09/fundamental-constitutional-rights-negated-realm-totalitarian-corporatocracy.html
Organization May Be Forced to Return Paid Patriotism Funds Again,https://www.activistpost.com/2017/09/governmnet-nfl-return-paid-patriotism-funds.html
"President Donald Trump’s Schedule for Sunday, October 1, 2017",http://beforeitsnews.com/u-s-politics/2017/09/president-donald-trumps-schedule-for-sunday-october-1-2017-2537070.html
Week 5 Rankings (2017): Top 15 Defenses,http://beforeitsnews.com/sports/2017/10/week-5-rankings-2017-top-15-defenses-2702024.html
"With iPhone’s New FaceID, Cops Can Unlock Your Phone by Pointing at Your Face-While You’re Cuffed",https://www.activistpost.com/2017/09/iphones-new-faceid-cops-can-unlock-phone-pointing-face-youre-cuffed.html
Ravens vs. Steelers - Friday/Game Status,http://beforeitsnews.com/sports/2017/09/ravens-vs-steelers-fridaygame-status-3-2701521.html
Illuminati Exposed: Their Plan To Use Food To Depopulate And Kill Us,http://dailybuzzlive.com/illuminati-exposed-plan-use-food-depopulate-kill-us/
CNN Cuts Off Critic of Leftist San Juan Mayor During Interview,http://beforeitsnews.com/u-s-politics/2017/10/cnn-cuts-off-critic-of-leftist-san-juan-mayor-during-interview-2537162.html
GOTW: Preston v Sunderland,http://beforeitsnews.com/sports/2017/09/gotw-preston-v-sunderland-2701426.html
"10 Important Stories From 09/25/17 Box Scores: Haniger’s Big Night, Judge Makes History & More",http://beforeitsnews.com/sports/2017/09/10-important-stories-from-092517-box-scores-hanigers-big-night-judge-makes-history-more-2701137.html
NEW!! America’s Next Civil War Progressives vs Patriots Now Under Way,http://beforeitsnews.com/religion/2017/10/new-americas-next-civil-war-progressives-vs-patriots-now-under-way-2535674.html
White House Press Briefing 9/27/17,http://beforeitsnews.com/u-s-politics/2017/09/white-house-press-briefing-92717-2536902.html
Texans QB DeShaun Watson Gives His Game Check to Three Women Impacted by Hurricane Harvey,http://beforeitsnews.com/sports/2017/09/texans-qb-deshaun-watson-gives-his-game-check-to-three-women-impacted-by-hurricane-harvey-2701334.html
Fantasy Football; Week 4 Advice,http://beforeitsnews.com/sports/2017/09/fantasy-football-week-4-advice-2701318.html
Ranking the Power 5 Football Conferences after Week 3 with Playoff Analysis,http://beforeitsnews.com/sports/2017/09/ranking-the-power-5-football-conferences-after-week-3-with-playoff-analysis-3-2701108.html
The Walking Dead Season 8: Season Premiere [sneak peak],http://beforeitsnews.com/u-s-politics/2017/10/the-walking-dead-season-8-season-premiere-sneak-peak-2537564.html
Jets add Pair of Free Agent Defenders to Front Seven; Donahue to IR,http://beforeitsnews.com/sports/2017/10/jets-add-pair-of-free-agent-defenders-to-front-seven-donahue-to-ir-2701948.html
Hundreds Injured As Police Shut Down Catalan Vote,http://beforeitsnews.com/u-s-politics/2017/10/hundreds-injured-as-police-shut-down-catalan-vote-2537103.html
"President Donald Trump’s Schedule for Wednesday, October 4, 2017",http://beforeitsnews.com/u-s-politics/2017/10/president-donald-trumps-schedule-for-wednesday-october-4-2017-2537239.html
Dealing with the Disconnect,http://beforeitsnews.com/sports/2017/09/dealing-with-the-disconnect-2701490.html
"Employers Can Now Refuse to Pay for Birth Control, Thanks To Trump",http://beforeitsnews.com/u-s-politics/2017/10/employers-can-now-refuse-to-pay-for-birth-control-thanks-to-trump-2537484.html
Austria's Islamophobic 'Burqa Ban' Criminalizes Muslim Women,http://beforeitsnews.com/u-s-politics/2017/10/austrias-islamophobic-burqa-ban-criminalizes-muslim-women-2537120.html
Las Vegas Shooting Makes Country Guitarist Change His Mind On Guns,http://beforeitsnews.com/u-s-politics/2017/10/las-vegas-shooting-makes-country-guitarist-change-his-mind-on-guns-2537201.html
A New Black Belt in Temple Karate,http://beforeitsnews.com/sports/2017/10/a-new-black-belt-in-temple-karate-2701860.html
Residents frightened by lights pulsating in the sky over Colombia,http://www.disclose.tv/news/bizarre_lights_pulsating_in_the_sky_over_colombia/140396
5 Glaring Inconsistencies in the Vegas Shooting that Need to be Addressed,https://www.activistpost.com/2017/10/5-glaring-inconsistencies-vegas-shooting-need-addressed.html
LA Releases First Single SHOWTIME,http://beforeitsnews.com/entertainment/2017/10/la-releases-first-single-showtime-2670642.html
"9/29 Through the 40s: HBD Cannonball & Paul, Camnitz Clan, Game Stories",http://beforeitsnews.com/sports/2017/09/929-through-the-40s-hbd-cannonball-paul-camnitz-clan-game-stories-2701470.html
Report: Chicago Bulls working on an extension for Gar Forman,http://beforeitsnews.com/sports/2017/10/report-chicago-bulls-working-on-an-extension-for-gar-forman-2701861.html
Woman Throws Drink On Lakers Fans Who Took A Knee During The Anthem,http://beforeitsnews.com/u-s-politics/2017/10/woman-throws-drink-on-lakers-fans-who-took-a-knee-during-the-anthem-2537483.html
Undercover in Antifa: Tactics and Media Support Exposed [video],http://beforeitsnews.com/u-s-politics/2017/09/undercover-in-antifa-tactics-and-media-support-exposed-video-2537045.html
Two-Minute Drill: Believe in the Chiefs?,http://beforeitsnews.com/sports/2017/10/two-minute-drill-believe-in-the-chiefs-2702094.html
"Bipartisan Congress Put Jeff Sessions in His Place, Shut Down His Expansion of Civil Asset Forfeiture",https://www.activistpost.com/2017/09/bipartisan-congress-put-jeff-sessions-place-shut-expansion-civil-asset-forfeiture.html
"10/8: HBD Tom, Donie, Danny, Catfish & Spanky; Hans #2; Cannonball Coming",http://beforeitsnews.com/sports/2017/10/108-hbd-tom-donie-danny-catfish-spanky-hans-2-cannonball-coming-2702239.html
2017 Fantasy Football Kicker Rankings - Week 4,http://beforeitsnews.com/sports/2017/09/2017-fantasy-football-kicker-rankings-week-4-2701252.html
"Post-Game Recap: Jets beat Jaguars in OT, 23-20",http://beforeitsnews.com/sports/2017/10/post-game-recap-jets-beat-jaguars-in-ot-23-20-2701659.html
"""Everything was burned"" Rohingya Remain Doubtful Of Myanmar's Promises",http://beforeitsnews.com/u-s-politics/2017/10/everything-was-burned-rohingya-remain-doubtful-of-myanmars-promises-2537204.html
Bloody Luck - A.F. Branco Cartoon,http://beforeitsnews.com/u-s-politics/2017/10/bloody-luck-a-f-branco-cartoon-2537643.html
"Yea, We Are In The Playoffs But...",http://beforeitsnews.com/sports/2017/10/yea-we-are-in-the-playoffs-but-2701632.html
Trump: ‘I might have made a mistake’ supporting Strange [video],http://beforeitsnews.com/u-s-politics/2017/09/trump-i-might-have-made-a-mistake-supporting-strange-video-2536713.html
Housing Bubble Symmetry,https://www.activistpost.com/2017/09/housing-bubble-symmetry-look.html
"10/2 Games: Bucs Clinch In '74, Boston Evens WS, Goose & Teke at 72, Triple-Bill, Game Stories",http://beforeitsnews.com/sports/2017/10/102-games-bucs-clinch-in-74-boston-evens-ws-goose-teke-at-72-triple-bill-game-stories-2701700.html
Tailgating - Dolphins vs Jets,http://beforeitsnews.com/sports/2017/10/tailgating-dolphins-vs-jets-2701762.html
Bump stock sales surge after use by Vegas gunman,http://beforeitsnews.com/u-s-politics/2017/10/bump-stock-sales-surge-after-use-by-vegas-gunman-2537356.html
Quantum Computer in a Nutshell,http://beforeitsnews.com/entertainment/2017/09/quantum-computer-in-a-nutshell-2670552.html
"10/2 Games: Bucs Clinch In '74, Boston Evens WS, Goose & Teke at 72, Triple-Bill, Game Stories",http://beforeitsnews.com/sports/2017/10/102-games-bucs-clinch-in-74-boston-evens-ws-goose-teke-at-72-triple-bill-game-stories-2701700.html
Will Security Measures Change In Response To Mass Shootings?,http://beforeitsnews.com/u-s-politics/2017/10/will-security-measures-change-in-response-to-mass-shootings-2537191.html
"Feds: International Plot to Shoot Up Concerts, Attack NYC Foiled - 3 arrested",http://beforeitsnews.com/u-s-politics/2017/10/feds-international-plot-to-shoot-up-concerts-attack-nyc-foiled-3-arrested-2537472.html
2017 Fantasy Football IDP Rankings - Week 5,http://beforeitsnews.com/sports/2017/10/2017-fantasy-football-idp-rankings-week-5-2702010.html
"After Alleged 'Moron' Remark, Tillerson Strokes Trump's Ego",http://beforeitsnews.com/u-s-politics/2017/10/after-alleged-moron-remark-tillerson-strokes-trumps-ego-2537294.html
Madagascar Plague Kills 20 Amid Unusually Rapid Rise In Cases,http://beforeitsnews.com/u-s-politics/2017/10/madagascar-plague-kills-20-amid-unusually-rapid-rise-in-cases-2537247.html
Trump’s Kids Allegedly Used Political Clout To Get Fraud Case Dropped,http://beforeitsnews.com/u-s-politics/2017/10/trumps-kids-allegedly-used-political-clout-to-get-fraud-case-dropped-2537305.html
Sheriff Won’t Charge The Teens Who Talked About Lynching A Student,http://beforeitsnews.com/u-s-politics/2017/10/sheriff-wont-charge-the-teens-who-talked-about-lynching-a-student-2537612.html
